{
  "$schema": "urn:agent-team:schema:github-scm-conformance-report:1.1.0",
  "actor_id": "github:68719118",
  "approval_evidence_ref": "github-actions://90le/agent-team-v10-conformance-private/runs/31557067000",
  "approval_expires_at": "2026-08-12T02:40:20Z",
  "approval_id": "approval-github-run-31557067000-attempt-1",
  "approval_issued_at": "2026-08-12T02:30:20Z",
  "approval_nonce": "github-run-31557067000-attempt-1-nonce",
  "approval_schema_version": "1.1.0",
  "approval_scope_digest": "sha256:4732e490c33b0ee2a70e0bc9c79cad55d0b797be229475c46a921d83a20bf8fb",
  "base_branch": "main",
  "base_commit": "0111dc5d0355e5efb00c3b0499ab11b0f2b5c3d0",
  "branch": {
    "created": true,
    "external_ref": "https://api.github.com/repos/90le/agent-team-v10-conformance-private/git/refs/heads/agent-team/v10-conformance-0111dc5d0355",
    "object_type": "branch",
    "provider_id": "REF_kwDOT10Vg9oAMnJlZnMvaGVhZHMvYWdlbnQtdGVhbS92MTAtY29uZm9ybWFuY2UtMDExMWRjNWQwMzU1"
  },
  "change_digest": "sha256:3f98d114ad2d4879ee33384144cdd3fe4ecbf7ad8901d7fb702e335bc66bdea4",
  "commit": {
    "created": true,
    "external_ref": "https://api.github.com/repos/90le/agent-team-v10-conformance-private/git/commits/b28c070f52d2bedf79b8f54055560ddd2ebbce1f",
    "object_type": "commit",
    "provider_id": "b28c070f52d2bedf79b8f54055560ddd2ebbce1f"
  },
  "deployment_performed": false,
  "draft_pull_request": {
    "created": true,
    "external_ref": "https://github.com/90le/agent-team-v10-conformance-private/pull/8",
    "object_type": "draft_pull_request",
    "provider_id": "PR_kwDOT10Vg8791Loo"
  },
  "evidence_kind": "github-scm-conformance-v1",
  "framework_commit": "065992bf055242e4d8c9de270781c0a6c3d5830c",
  "framework_repository": "90le/agent-team-engineering",
  "identity_provider": "github.actions",
  "identity_ref": "github-actions://90le/agent-team-v10-conformance-private/runs/31557067000/attempts/1",
  "issue": {
    "created": true,
    "external_ref": "https://github.com/90le/agent-team-v10-conformance-private/issues/7",
    "object_type": "issue",
    "provider_id": "I_kwDOT10Vg88AAAABMZCuNg"
  },
  "merge_performed": false,
  "plan_digest": "sha256:1ecd6602e1f1f61ec6f56abe9fe633bd58d11f013b641a8904d9f4a98f3423f3",
  "plan_schema_version": "1.1.0",
  "proposal_branch": "agent-team/v10-conformance-0111dc5d0355",
  "repository": "90le/agent-team-v10-conformance-private",
  "repository_id": "repo.conformance.github.v10",
  "repository_private": true,
  "schema_version": "1.1.0",
  "workflow": {
    "path": ".github/workflows/agent-team-v10-conformance.yml",
    "ref": "90le/agent-team-v10-conformance-private/.github/workflows/agent-team-v10-conformance.yml@refs/heads/main",
    "repository_ref": "refs/heads/main",
    "run_attempt": "1",
    "run_id": "31557067000",
    "run_url": "https://github.com/90le/agent-team-v10-conformance-private/actions/runs/31557067000",
    "sha": "0111dc5d0355e5efb00c3b0499ab11b0f2b5c3d0"
  },
  "writer_topology": null
}
